{
  "schema_version": "1.0.0",
  "event_id": "55555555-5555-4555-8555-555555555555",
  "event_type": "assessment.practice.completed",
  "event_version": "1.0.0",
  "owner": "assessment",
  "occurred_at": "2026-10-16T15:00:00Z",
  "idempotency_key": "44444444-4444-4444-8444-444444444444",
  "aggregate": {
    "aggregate_type": "practice_attempt",
    "aggregate_id": "33333333-3333-4333-8333-333333333333"
  },
  "source": {"evidence_id": "44444444-4444-4444-8444-444444444444"},
  "payload": {
    "learner_id": "11111111-1111-4111-8111-111111111111",
    "submission_id": "22222222-2222-4222-8222-222222222222",
    "placement_id": "risk-return-practice-placement",
    "package_id": "intro-risk-return",
    "package_version": "2.0.0",
    "package_digest": "aaaaaaaaaaaaaaaaaaaaaaaaaaaaaaaaaaaaaaaaaaaaaaaaaaaaaaaaaaaaaaaa",
    "definition_digest": "82cdc82c402aacdb0070fb19671d896ae22a4c16d338ccbf27f02a51a396d527",
    "practice_id": "risk-return-practice",
    "practice_version": "1.0.0",
    "attempt_policy_id": "formative-retry",
    "attempt_policy_version": "1.0.0",
    "score": 2,
    "max_score": 3,
    "outcome": "review_needed",
    "item_scores": [
      {"item_id": "risk-meaning", "item_version": "1.0.0", "item_type": "single_select", "scoring_policy_id": "single-select-exact-match", "scoring_policy_version": "1.0.0", "score": 1, "max_score": 1},
      {"item_id": "diversification-actions", "item_version": "1.0.0", "item_type": "multiple_select", "scoring_policy_id": "multiple-select-exact-set", "scoring_policy_version": "1.0.0", "score": 0, "max_score": 1},
      {"item_id": "simple-growth", "item_version": "1.0.0", "item_type": "numeric_entry", "scoring_policy_id": "numeric-exact-or-inclusive-range", "scoring_policy_version": "1.0.0", "score": 1, "max_score": 1}
    ],
    "completed_at": "2026-10-16T15:00:00Z"
  }
}
